Title,Hook,Connection,Compromise,Call to Åction
The Hero's First Step,What if your creative journey began with a single decision?,Åction starts when curiosity meets courage.,80% of breakthroughs come after that first bold step—what’s yours?,Begin with one question: What if your next move is already waiting for you?
The Power of Small Åctions,Could one small shift change everything?,Each micro-step carries the energy of transformation.,Research shows consistent small actions create momentum. Could this be your starting line?,What’s one small thing you can do today to activate your creative power?
Redefining Åction,What if Åction is more about becoming than doing?,It’s not what you do—it’s how you align with your purpose.,Clarity studies show purpose-driven goals are 42% more likely to be achieved.,Pause. Reflect. What are you becoming today?
The Catalyst Within,What if the spark you’re waiting for is already inside you?,Åction doesn’t require permission—just ignition.,98% of people who act on their instincts report feeling more aligned. What could you align with now?,Feel the spark. What are you ready to light up?
Movement Over Perfection,Could progress matter more than perfection?,"Åction thrives on motion, not flawless execution.",Perfection paralysis impacts 7 out of 10 creators. What if you simply moved instead?,What’s one imperfect move you can make today?
The Åction Identity,Who are you when you’re in motion?,Your identity is revealed in what you choose to create.,Studies in psychology show that actions shape self-perception. What will your next move say about you?,Define yourself through motion. What are you creating?
The Momentum Principle,What if momentum is the real magic?,"One step leads to another, building unstoppable energy.",Newton was right—objects in motion stay in motion. Could you be the next unstoppable force?,What’s one move you’ll make to stay in motion?
Overcoming Resistance,What if resistance is just a sign of your next breakthrough?,Every creator faces resistance; it’s part of the process.,Science shows mental friction precedes creative breakthroughs. Could this be your moment?,Lean into the resistance. What’s waiting on the other side?
Your Creative Compass,Where is your creativity pointing you right now?,Your intuition knows the way; Åction follows its lead.,72% of successful creators cite intuition as their guiding force. Are you listening to yours?,Follow the pull. What direction feels most alive for you?
Awakening the Åction Figure,What if your inner hero has been waiting for you all along?,Every hero’s journey begins with recognizing their potential.,"Even superheroes start small—one mission, one Åction. What’s your first mission?",Activate the hero. What’s the first move your Åction Figure self would take?
Discovering Your Åction Identity,What if your creative identity was waiting to be named?,Your unique essence guides every choice you make.,Studies show self-awareness boosts creative output by 35%.,Take a moment. What would you name your creative superpower?
The Blueprint of You,Could your creativity be a blueprint waiting to unfold?,Every Åction Figure begins with a unique design.,Designing with intention increases success rates by 20%.,Sketch your blueprint. What does your creative design look like?
Claiming Your Signature Move,What’s the one move only you can make?,Your signature move is your creative fingerprint.,Experts say unique contributions lead to higher innovation.,Identify your move. What sets your creativity apart?
Your Åction Figure’s Armor,What protects your creativity in the face of doubt?,Every hero has armor that shields and empowers.,Resilient creators overcome 80% of external challenges.,What’s your armor? How does it protect your creative flow?
The Energy of Intent,What happens when you infuse your Åctions with intent?,Intent transforms ordinary moves into extraordinary ones.,Science links focused intent with higher levels of achievement.,Set your intent. What energy are you bringing to your creations?
Naming Your Creative Archetype,What archetype defines your creative journey?,Archetypes help us understand and embody our potential.,Studies show clarity of role enhances decision-making by 50%.,Name your archetype. Who are you becoming in this creative journey?
Embodying Your Åction Aura,What aura do your Åctions project?,Your energy speaks louder than words.,Positive energy boosts team collaboration by 25%.,Define your aura. What vibe do your Åctions carry?
Designing the Hero’s Path,What’s your hero’s journey in creativity?,Every great creator maps their path forward.,Mapped goals increase productivity by 60%.,Chart your path. What’s the next milestone in your journey?
Building Your Åction Legacy,What story will your creativity leave behind?,Your legacy is built Åction by Åction.,Creators who focus on impact report deeper satisfaction.,Reflect on your legacy. What story are your Åctions writing?
Unveiling the Inner Hero,What if your inner hero is already awake?,Your hero is ready to take center stage.,Those who embody their potential inspire 40% more connections.,Step into the spotlight. What’s your inner hero ready to reveal?
Momentum Over Stagnation,What if forward motion was the antidote to feeling stuck?,Momentum creates clarity and builds confidence.,Studies show 70% of progress happens when action replaces hesitation.,Take one step. What’s your next move?
The Chain Reaction of Åction,What happens when one move sparks another?,Åction is a chain reaction that fuels creativity.,Psychologists find starting creates a 40% boost in motivation.,Start small. What’s your spark?
Breaking the Inertia Barrier,Could your first step break the cycle of inertia?,The hardest part of any journey is often the beginning.,92% of successful creators say starting was their biggest challenge.,Move forward. What’s one step you can take right now?
The Ripple Effect of Movement,What if one small action could change everything?,Every move sends ripples into your creative universe.,"Small, consistent actions amplify long-term impact.",Create a ripple. What’s one action you’ll take today?
Reframing Setbacks as Steps,What if setbacks were just steps in disguise?,Every fall is an opportunity to rise stronger.,Reframing challenges increases resilience by 80%.,What’s one way you can turn a setback into a step forward?
The Energy of Starting,Could starting be the most powerful energy you create?,The start of anything holds unmatched creative potential.,Momentum builds exponentially after the first action.,Feel the energy. What are you ready to start?
Momentum as a Superpower,What if momentum was your ultimate superpower?,Momentum transforms ordinary actions into extraordinary outcomes.,90% of high performers credit momentum for their breakthroughs.,Harness your momentum. What’s keeping you in motion?
The Creative Pendulum,What happens when your pendulum swings toward Åction?,Creativity thrives on the balance of rest and motion.,Balancing effort with recovery improves creativity by 25%.,Swing into motion. What’s pulling your pendulum today?
From Hesitation to Flow,Could your hesitation be transformed into creative flow?,Hesitation is a pause before momentum takes over.,Studies show embracing uncertainty sparks innovation.,Embrace the flow. What’s one hesitation you can turn into motion?
Åction as the Bridge,What if Åction was the bridge between dreaming and doing?,Every dream needs movement to become reality.,Bridge-building actions lead to a 50% higher success rate.,Cross the bridge. What’s one dream you’ll move toward today?
Reframing Resistance,What if resistance was your greatest teacher?,Resistance reveals where growth is ready to happen.,85% of breakthroughs are preceded by a moment of friction.,Lean into resistance. What’s it trying to teach you?
The Gift of Friction,Could friction be the spark for your next breakthrough?,Every spark of creativity is born from overcoming a challenge.,Physics teaches us that friction generates energy. What energy can you generate from this challenge?,Find the gift. What energy is ready to ignite for you?
Resistance as a Signal,What if resistance was just a sign you’re on the right path?,Resistance often means you’re pushing toward something meaningful.,95% of meaningful goals encounter resistance. Could this be yours?,Follow the signal. What resistance are you ready to face?
Dancing with Doubt,What if doubt was an invitation to dance?,"Doubt invites you to explore, adapt, and evolve.",Transforming doubt into curiosity leads to 30% greater creative output.,Take the step. How can you dance with your doubt today?
Turning Fear into Fuel,Could your fear become the fuel for your Åction?,Fear holds energy that can be redirected into creativity.,Redirected fear has been shown to increase performance by 45%.,Use the fuel. What fear can you channel into motion?
The Breakthrough Threshold,What if your breakthrough was just beyond the struggle?,Struggle often means you’re closer to the goal than you think.,Creativity spikes 40% when people persist through challenges.,Cross the threshold. What’s one struggle you’re ready to overcome?
Welcoming Creative Tension,What happens when you embrace tension instead of avoiding it?,Creative tension is the birthplace of innovation.,Leaning into tension improves problem-solving by 50%.,Embrace the tension. What can you create from it?
The Opposite of Resistance,What if the opposite of resistance was surrender?,Surrender allows creativity to flow freely.,Flow state is 5x more productive than resistance-based effort.,Find the flow. What can you surrender to today?
Releasing the Need for Control,What if letting go gave you the greatest control of all?,Creativity thrives when you release rigid expectations.,Studies show letting go reduces creative blocks by 70%.,Let go. What are you ready to release today?
The Alchemy of Resistance,Could resistance be transformed into pure creative gold?,Alchemy turns challenges into opportunities.,Reframing obstacles leads to 2x more creative solutions.,Transform the challenge. What will you alchemize today?
The Power of Collaboration,What if your creativity thrives when shared?,Collaboration multiplies creative energy.,Teams that collaborate effectively innovate 60% faster.,Who can you partner with to amplify your next idea?
The Magic of Many Minds,Could multiple minds create something greater than one?,The best ideas often emerge from shared perspectives.,Group brainstorming boosts idea generation by 45%.,Gather your circle. What idea can you co-create?
Celebrating Collective Wins,What if your success is part of a larger story?,Every individual victory strengthens the collective.,"Shared wins build stronger, more cohesive teams.",What collective success can you celebrate today?
The Synergy Principle,What happens when your energy combines with others’?,Synergy creates exponential creative possibilities.,Studies show synergy increases problem-solving efficiency by 50%.,Who’s in your creative ecosystem? What could you build together?
Finding Your Creative Mirror,Who reflects your best creative self?,A creative mirror helps you see new dimensions of your potential.,Mutual support boosts creative confidence by 70%.,Find your mirror. Who inspires your creativity?
The Ecosystem of Ideas,What if your ideas were seeds in a shared garden?,Collaboration nurtures and grows ideas into realities.,Ideas shared within teams evolve 3x faster than isolated ones.,Plant your seed. Who will help it grow?
The Resonance Effect,Could your creativity resonate more powerfully with others?,Creative resonance amplifies impact and reach.,Collaborative projects reach 80% more audiences on average.,What’s one idea you can co-create to resonate widely?
Building Creative Bridges,What if you could bridge ideas into new dimensions?,Collaboration bridges gaps and creates unity.,Bridging diverse ideas leads to 2x more innovative solutions.,What bridge can you build today between your ideas and someone else’s?
The Art of Listening in Collaboration,What if listening was the key to co-creation?,Deep listening uncovers hidden gems in ideas.,Teams that prioritize listening perform 30% better.,Listen deeply. What idea can you unlock through collaboration?
Your Role in the Creative Symphony,What’s your unique note in the creative symphony?,Every creator adds something essential to the whole.,Diverse contributions increase creative richness by 40%.,Play your note. What will you contribute to the symphony?
Living Your Creative Legacy,What if every action you take becomes part of your legacy?,"Your legacy is built moment by moment, action by action.",Creators who focus on impact report 50% greater fulfillment.,What action will you take today to shape your creative legacy?
The Ripple Effect of Creativity,Could your creativity inspire others to create?,Every creative act sends ripples through the collective.,Inspired creativity multiplies impact across communities.,What ripple will you create today?
Your Creativity as a Gift,What if your creativity was the greatest gift you could share?,Sharing your ideas enriches the world around you.,Giving creative energy fosters deeper connections.,What creative gift are you ready to share?
Becoming a Beacon of Inspiration,What if your light helps others find their path?,Your creative expression inspires those who witness it.,Creativity shared openly attracts like-minded collaborators.,Shine your light. Who will you inspire today?
The Infinite Arc of Learning,What if creativity is a journey with no end?,Every action adds to your evolving story of growth.,Continuous learning fuels creative innovation by 70%.,What new lesson will you embrace on your creative journey?
Leaving a Trail for Others,Could your creativity pave the way for others to follow?,Your actions create a path for future creators.,Trailblazers ignite 2x the innovation in their communities.,What trail will your creativity leave behind?
Creating in the Present Moment,What if the only moment that matters is now?,"Creativity thrives in the present, free from past or future.",Mindful creation enhances focus and output by 45%.,What will you create in this moment of infinite potential?
The Web of Creative Connection,What if your creativity weaves a web of connection?,Every creative act links you to a greater whole.,Collaborative networks amplify collective impact by 60%.,What connections will your creativity spark?
The Courage to Create Boldly,What if boldness was the key to unlocking your creative power?,Bold creators inspire movements and transformations.,Fearless creativity generates 3x the engagement.,What bold step will you take to unlock your creative potential?
Your Story as Creative Energy,What if your story was the ultimate source of inspiration?,Your unique experiences fuel your creative power.,Authentic storytelling increases creative resonance by 50%.,What part of your story will you share today?